{"producer_identity":"https://github.com/example/evidence/.github/workflows/retain.yml","producer_implementation":"aws-cli","schema_version":"artifact-verification.v1","statement_sha256":"8dfb0d8aef4d907cfc6e50ffda7a334b7ea008b2d36665cfb1f0f10334ba7b88","status":"passed","trust_policy_sha256":"ea4adcf48c6f2753d934016c1d02b4bb75d1024fd14ee1bcb56002f408d5b501","verification_evidence_sha256":"915b47bc71b5201e59e15ba79c0f58222dec055cd996a89fb905c1af5295d37d","verification_id":"retained-evidence-verification","verified_at":"2026-07-11T12:00:30Z","verifier":{"identity":"qualification-runner","implementation":"cosign","version":"3.0.5"},"artifact":{"immutable_revision":"version-id:fixture-v1","media_type":"application/mcap","sha256":"b55b1327d97412b150ada1a77be869545eb65bb65db52d0d69e6e6a5fb5138de","size_bytes":30,"uri":"s3://robotics-fixture/run-10000000-0000-4000-8000-000000000001/output.mcap?versionId=fixture-v1"}}
