{"producer_identity":"https://github.com/example/evaluator/.github/workflows/release.yml","producer_implementation":"pypa-build","schema_version":"artifact-verification.v1","statement_sha256":"3c2a456f4a404c944235b41f3e7a2add3d8dca175ddccf84ffeaf8e0c78d5504","status":"passed","trust_policy_sha256":"ea4adcf48c6f2753d934016c1d02b4bb75d1024fd14ee1bcb56002f408d5b501","verification_evidence_sha256":"2b060d205139c379748ba98a72cff7b516e7784508787c71533e67d1a7039950","verification_id":"evaluator-wheel-verification","verified_at":"2026-07-11T11:59:00Z","verifier":{"identity":"qualification-runner","implementation":"cosign","version":"3.0.5"},"artifact":{"immutable_revision":"sha256:a9f3c61cefdc82ae15ea38847921437b5bf521d6d5a05171226284fe597e7210","media_type":"application/vnd.python.wheel","sha256":"a9f3c61cefdc82ae15ea38847921437b5bf521d6d5a05171226284fe597e7210","size_bytes":24,"uri":"file:///packages/evaluator-a9f3c61cefdc82ae15ea38847921437b5bf521d6d5a05171226284fe597e7210.whl"}}
